{
  "plugin_id": "ai-image-studio",
  "name": "AI 生图工作室",
  "summary": "提示词生图、参数控制和图库入库的一站式后台插件。",
  "description": "为后台提供 AI 生图能力，支持提示词、尺寸、质量配置，并把生成结果归档到图库。",
  "version": "1.0.0",
  "latest_version": "1.0.0",
  "category": "automation",
  "source": "github-market",
  "source_repo": "natsume37/Blog-backend",
  "author": "Martin",
  "icon": "PictureFilled",
  "official": true,
  "verified": true,
  "builtin": true,
  "installable": true,
  "activatable": true,
  "license": "MIT",
  "pricing": "free",
  "published_at": "2026-03-10T14:31:31Z",
  "homepage": "https://martin88.xyz",
  "repo_url": "https://github.com/natsume37/Blog-backend",
  "docs_url": "https://github.com/natsume37/Blog-backend/blob/main/README.md",
  "support_url": "https://github.com/natsume37/Blog-backend/issues",
  "changelog_url": "https://github.com/natsume37/Blog-backend/commits/main",
  "manifest_url": "https://raw.githubusercontent.com/natsume37/Blog-plugin-market/main/plugins/ai-image-studio.json",
  "tags": ["ai", "image", "gallery"],
  "features": ["提示词生图", "尺寸配置", "质量控制", "图库入库"],
  "permissions": ["ai:image", "media:write", "plugin:config"],
  "compatibility": {
    "backend": ">=1.0.0",
    "frontend": ">=1.0.0"
  },
  "delivery": {
    "type": "builtin",
    "entry_mode": "local",
    "install_strategy": "builtin-toggle",
    "entry_url": ""
  },
  "publisher": {
    "name": "Martin",
    "url": "https://github.com/natsume37"
  },
  "screenshots": [],
  "admin_pages": [
    {
      "key": "studio",
      "path": "/admin/plugins/ai-image-studio/studio",
      "route_name": "plugin-ai-image-studio-studio",
      "title": "AI 生图",
      "menu_label": "AI 生图",
      "component_key": "plugin.ai.image",
      "icon": "PictureFilled",
      "render_mode": "local",
      "entry_url": "",
      "script_url": "",
      "layout": "workspace"
    }
  ]
}
