{
  "plugin_id": "wechat-official-account",
  "name": "微信公众号发布",
  "summary": "把文章发到公众号草稿箱或直接进入发布流。",
  "description": "维护微信公众号素材接口配置，并在后台文章页中发起上传、草稿创建和发布操作。",
  "version": "1.0.0",
  "latest_version": "1.0.0",
  "category": "distribution",
  "source": "github-market",
  "source_repo": "natsume37/Blog-backend",
  "author": "Martin",
  "icon": "Promotion",
  "official": true,
  "verified": true,
  "builtin": true,
  "installable": true,
  "activatable": true,
  "license": "MIT",
  "pricing": "free",
  "published_at": "2026-03-10T00:00:00Z",
  "homepage": "https://martin88.xyz",
  "repo_url": "https://github.com/natsume37/Blog-backend",
  "docs_url": "https://github.com/natsume37/Blog-backend/blob/main/README.md",
  "support_url": "https://github.com/natsume37/Blog-backend/issues",
  "changelog_url": "https://github.com/natsume37/Blog-backend/commits/main",
  "manifest_url": "https://raw.githubusercontent.com/natsume37/Blog-plugin-market/main/plugins/wechat-official-account.json",
  "tags": ["wechat", "distribution", "publisher"],
  "features": ["草稿上传", "公众号发布", "快捷入口"],
  "permissions": ["wechat:material", "article:read", "plugin:config"],
  "compatibility": {
    "backend": ">=1.0.0",
    "frontend": ">=1.0.0"
  },
  "delivery": {
    "type": "builtin",
    "entry_mode": "local",
    "install_strategy": "builtin-toggle",
    "entry_url": ""
  },
  "publisher": {
    "name": "Martin",
    "url": "https://github.com/natsume37"
  },
  "screenshots": [],
  "admin_pages": [
    {
      "key": "publisher",
      "path": "/admin/plugins/wechat-official-account/publisher",
      "route_name": "plugin-wechat-official-account-publisher",
      "title": "公众号发布",
      "menu_label": "公众号发布",
      "component_key": "plugin.wechat.settings",
      "icon": "Promotion",
      "render_mode": "local",
      "entry_url": ""
    }
  ]
}
